<?xml version="1.0" encoding="UTF-8"?>

<xs:schema xmlns:xs="http://www.w3.org/2001/XMLSchema">
	
	<xs:element name="contacts">
		<xs:complexType>
			<xs:sequence>
				<xs:element ref="contact" minOccurs="1" maxOccurs="unbounded"/>
			</xs:sequence>
		</xs:complexType>
	</xs:element>
	
	<xs:element name="contact">
		<xs:complexType>
			<xs:sequence>
				<xs:element ref="identité"/>
				<xs:element name="email" type="xs:string"/>
			</xs:sequence>
		</xs:complexType>
	</xs:element>
	
	<xs:element name="identité">
		<xs:complexType>
			<xs:sequence>	
				<xs:element name="nom" type="xs:string"/>
				<xs:element name="prénom" type="xs:string"/>
				<xs:element name="date_naissance" type="xs:date"/>
			</xs:sequence>
		</xs:complexType>
	</xs:element>
	
</xs:schema>
