<?xml version="1.0" encoding="UTF-8" standalone="no" ?>
<contacts xmlns:xsi="http://www.w3.org/2001/XMLSchema-instance"
          xsi:noNamespaceSchemaLocation="contactsV1.xsd">
    <contact>
        <identité>
            <nom>Blanquaert</nom>
            <prénom>Jacques</prénom>
            <date_naissance>2022-10-23</date_naissance>
        </identité>
        <email>jblanquaert@sfr.fr</email>
    </contact>
    <contact>
        <identité>
            <nom>Giraud</nom>
            <prénom>Sophie</prénom>
            <date_naissance>2001-08-13</date_naissance>
        </identité>
    </contact>
    <contact>
        <identité>
            <nom>Dupont</nom>
            <prénom>Jean</prénom>
            <date_naissance>2001-06-01</date_naissance>
        </identité>
        <email>jeandudu@orange.fr</email>
    </contact>
</contacts>
